{
  "$schema": "http://json-schema.org/draft-07/schema#",
  "$id": "https://matrixos.edu/contracts/matrix-app-manifest.schema.json",
  "title": "MatrixOS_MicroApp_Manifest",
  "description": "第三方课题组微站接入 MatrixOS 星轨的标准插槽声明。任何高校实验室只需提供此 manifest，即可在星轨图上生成专属星球胶囊并接入全局虫洞环。",
  "type": "object",
  "required": ["manifest_version", "app_id", "name", "entry_url", "orbit_station", "accepts", "emits"],
  "additionalProperties": false,
  "properties": {
    "manifest_version": {
      "type": "string",
      "const": "1.0",
      "description": "插槽协议版本"
    },
    "app_id": {
      "type": "string",
      "pattern": "^[a-z0-9][a-z0-9-]{1,30}[a-z0-9]$",
      "description": "全局唯一微站标识，用作子域名前缀"
    },
    "name": {
      "type": "string",
      "maxLength": 40,
      "description": "微站中文名称，显示在星轨胶囊上"
    },
    "entry_url": {
      "type": "string",
      "format": "uri",
      "description": "独立子域名入口，如 https://bioscan.matrixos.edu"
    },
    "orbit_station": {
      "type": "string",
      "description": "挂载的星轨层级（7 站生涯闭环）",
      "enum": ["study", "spark", "pat_hot", "xingmen", "workshop", "cloud_balance", "pre_job"]
    },
    "icon": {
      "type": "string",
      "description": "胶囊图标，建议 SVG data-uri 或 https URL"
    },
    "accent_color": {
      "type": "string",
      "pattern": "^#[0-9a-fA-F]{6}$",
      "description": "该微站的主强调色，用于星轨星球着色"
    },
    "accepts": {
      "type": "array",
      "description": "可接收的虫洞 payload_type 列表；空数组表示不接收虫洞投送",
      "items": {
        "type": "string",
        "enum": [
          "paper_doi_bundle",
          "comparison_matrix_row",
          "curve_fit_parameters",
          "mentor_match_card",
          "verified_cv_evidence"
        ]
      }
    },
    "emits": {
      "type": "array",
      "description": "可向外投送的虫洞 payload_type 列表；空数组表示纯接收端",
      "items": {
        "type": "string",
        "enum": [
          "paper_doi_bundle",
          "comparison_matrix_row",
          "curve_fit_parameters",
          "mentor_match_card",
          "verified_cv_evidence"
        ]
      }
    },
    "live_mini_view": {
      "type": "object",
      "description": "星轨胶囊的实况微缩态数据源。未点开微站时，胶囊上直接显示该数据。可选。",
      "properties": {
        "endpoint": { "type": "string", "format": "uri" },
        "refresh_seconds": { "type": "integer", "minimum": 60, "maximum": 86400 },
        "display_field": { "type": "string" }
      },
      "required": ["endpoint"]
    },
    "permissions": {
      "type": "array",
      "description": "申请的 MatrixID 授权范围",
      "items": {
        "type": "string",
        "enum": ["matrix_id:read", "profile:read", "assets:read", "assets:write", "wormhole:send", "wormhole:receive"]
      }
    },
    "author": {
      "type": "object",
      "properties": {
        "lab_name": { "type": "string" },
        "university": { "type": "string" },
        "contact_email": { "type": "string", "format": "email" }
      }
    }
  }
}
