{
  "manifest_version": "1.0",
  "app_id": "chart-foundry",
  "name": "Nature 级出版图表熔炉",
  "entry_url": "https://chart-foundry.matrixos.cc.cd",
  "orbit_station": "workshop",
  "accent_color": "#10b981",
  "accepts": [
    "curve_fit_parameters",
    "comparison_matrix_row"
  ],
  "emits": [
    "comparison_matrix_row"
  ],
  "permissions": [
    "matrix_id:read",
    "profile:read",
    "assets:read",
    "assets:write",
    "wormhole:send",
    "wormhole:receive"
  ],
  "author": {
    "lab_name": "MatrixOS",
    "university": "MatrixOS"
  }
}
