{
  "manifest_version": "1.0",
  "app_id": "retract-radar",
  "name": "撤稿深海声呐与伦理合规仪",
  "entry_url": "https://retract-radar.matrixos.cc.cd",
  "orbit_station": "workshop",
  "accent_color": "#10b981",
  "accepts": [
    "paper_doi_bundle"
  ],
  "emits": [
    "paper_doi_bundle"
  ],
  "permissions": [
    "matrix_id:read",
    "profile:read",
    "assets:read",
    "assets:write",
    "wormhole:send",
    "wormhole:receive"
  ],
  "author": {
    "lab_name": "MatrixOS",
    "university": "MatrixOS"
  }
}
