{
  "manifest_version": "1.0",
  "app_id": "gpa",
  "name": "学分绩点动态配重台",
  "entry_url": "https://gpa.matrixos.edu",
  "orbit_station": "study",
  "accent_color": "#6366f1",
  "accepts": [
    "verified_cv_evidence"
  ],
  "emits": [
    "verified_cv_evidence"
  ],
  "permissions": [
    "matrix_id:read",
    "profile:read",
    "assets:read",
    "assets:write",
    "wormhole:send",
    "wormhole:receive"
  ],
  "author": {
    "lab_name": "MatrixOS",
    "university": "MatrixOS"
  }
}
